<?xml version="1.0" encoding="UTF-8"?>
<radio xmlns:xsi="http://www.w3.org/2001/XMLSchema-instance" xsi:noNamespaceSchemaLocation="radio.xsd">
	<coordinates>
		<x>135.33</x>
		<y>354.72</y>
	</coordinates>
	<activeFrame>2</activeFrame>
	<cellID>30010</cellID>
	<coordinates>
		<main>0</main>
		<fractional>0</fractional>
	</coordinates>
</radio>
